{
  "inputIndex": 2,
  "documentId": "ro-unsupported-cii",
  "fileName": "unsupported_cii.xml",
  "processingStatus": "FAILED",
  "conformanceStatus": "NOT_EVALUATED",
  "previewConformanceStatus": "NOT_EVALUATED",
  "validationScope": "OFFLINE_PREFLIGHT",
  "externalStateStatus": "NOT_EVALUATED_EXTERNAL_STATE",
  "rulesetEffectiveAt": "2024-06-05",
  "sourceFormat": "UNKNOWN",
  "validationFamily": "UNKNOWN",
  "syntax": "UNKNOWN",
  "profile": "UNKNOWN",
  "scenario": null,
  "versions": {
    "ubl": "2.1",
    "ciusRo": "1.0.1",
    "roSchematron": "1.0.9",
    "embeddedEn16931": "1.3.8",
    "saxonHe": "10.9",
    "saxonHeSha256": "491d8edf4ec811d15c2b2417b007218b9b938f15e4dfbad004025beb4e70e960",
    "compiledSchematronSha256": "3088b39e24dab440dc98b55cb4ba6845a5fd22b382da1f376f592ee6e0d0f2eb",
    "temurinJreImage": "eclipse-temurin:21-jre-jammy@sha256:d63bd8d9b171999cbed8576f2c76e874dd4856791a358536e5c4d407e77edc13",
    "schematronSkeleton": "02f3707b194ce5792bf77b14a66d782c060abba3",
    "roRulesArchiveSha256": "818e7dd77e429f5dbde7c60b43dddbdf1a9a82a1773c359caa80a36ef89ea7f2",
    "ublArchiveSha256": "60b80d76394a8a2add90723ecb8e0e2e9d826775de9749df37a72d60703f86ed",
    "activeRuleset": {
      "name": "CIUS-RO 1.0.1 / ro16931-ubl 1.0.9",
      "effectiveAt": "2024-06-05"
    },
    "artifactManifestSha256": "39add0e63650bd7ee218eaeae8459ee912331280be57ee686815977dd7e404ce"
  },
  "counts": {
    "fatal": 0,
    "error": 0,
    "warning": 0,
    "information": 0
  },
  "findings": [],
  "findingsTruncated": false,
  "previewCounts": {
    "fatal": 0,
    "error": 0,
    "warning": 0,
    "information": 0
  },
  "previewFindings": [],
  "previewFindingsTruncated": false,
  "sha256": null,
  "embeddedXmlSha256": null,
  "container": null,
  "checkedAt": "2026-07-29T11:24:49.736973Z",
  "reports": {},
  "error": {
    "code": "UNSUPPORTED_DOCUMENT",
    "message": "The XML root does not match a supported invoice syntax"
  }
}
